{
  "$id": "https://posthog-impact.local/schemas/actors.schema.json",
  "$schema": "https://json-schema.org/draft/2020-12/schema",
  "additionalProperties": false,
  "properties": {
    "account_type": {
      "arrow_type": "string",
      "type": [
        "string",
        "null"
      ]
    },
    "actor_id": {
      "arrow_type": "string",
      "type": [
        "string",
        "null"
      ]
    },
    "actor_identity_version": {
      "arrow_type": "string",
      "type": [
        "string",
        "null"
      ]
    },
    "ambiguity_reasons": {
      "arrow_type": "list<element: string>",
      "type": [
        "array",
        "null"
      ]
    },
    "ambiguity_status": {
      "arrow_type": "string",
      "type": [
        "string",
        "null"
      ]
    },
    "bot_probability": {
      "arrow_type": "double",
      "type": [
        "number",
        "null"
      ]
    },
    "bot_reasons": {
      "arrow_type": "list<element: string>",
      "type": [
        "array",
        "null"
      ]
    },
    "display_name": {
      "arrow_type": "string",
      "type": [
        "string",
        "null"
      ]
    },
    "email_count": {
      "arrow_type": "int64",
      "type": [
        "integer",
        "null"
      ]
    },
    "emails": {
      "arrow_type": "list<element: string>",
      "type": [
        "array",
        "null"
      ]
    },
    "git_names": {
      "arrow_type": "list<element: string>",
      "type": [
        "array",
        "null"
      ]
    },
    "github_database_id": {
      "arrow_type": "int64",
      "type": [
        "integer",
        "null"
      ]
    },
    "github_typename": {
      "arrow_type": "string",
      "type": [
        "string",
        "null"
      ]
    },
    "identity_cluster_id": {
      "arrow_type": "string",
      "type": [
        "string",
        "null"
      ]
    },
    "identity_cluster_members": {
      "arrow_type": "list<element: string>",
      "type": [
        "array",
        "null"
      ]
    },
    "identity_cluster_size": {
      "arrow_type": "int64",
      "type": [
        "integer",
        "null"
      ]
    },
    "is_ai_assistant_identity": {
      "arrow_type": "bool",
      "type": [
        "boolean",
        "null"
      ]
    },
    "is_bot": {
      "arrow_type": "bool",
      "type": [
        "boolean",
        "null"
      ]
    },
    "login": {
      "arrow_type": "string",
      "type": [
        "string",
        "null"
      ]
    },
    "sources": {
      "arrow_type": "list<element: string>",
      "type": [
        "array",
        "null"
      ]
    }
  },
  "title": "actors",
  "type": "object",
  "x-pipeline-version": "1.0.0",
  "x-schema-version": "1.0.0"
}
