[
  {
    "account_type": "git_identity",
    "actor_id": "git/email/000f1f290844d853",
    "actor_identity_version": "1.0.0",
    "ambiguity_reasons": [
      "no_github_login: identified by git email only"
    ],
    "ambiguity_status": "ambiguous",
    "bot_probability": 0.0,
    "bot_reasons": [],
    "display_name": "Sachin Ranchod",
    "email_count": 1,
    "emails": [
      "sachin.ranchod@gmail.com"
    ],
    "git_names": [
      "Sachin Ranchod"
    ],
    "github_database_id": null,
    "github_typename": null,
    "identity_cluster_id": "git/email/000f1f290844d853",
    "identity_cluster_members": [
      "git/email/000f1f290844d853"
    ],
    "identity_cluster_size": 1,
    "is_ai_assistant_identity": false,
    "is_bot": false,
    "login": null,
    "sources": [
      "git_author"
    ]
  },
  {
    "account_type": "git_identity",
    "actor_id": "git/email/0027f67ffa878114",
    "actor_identity_version": "1.0.0",
    "ambiguity_reasons": [
      "no_github_login: identified by git email only"
    ],
    "ambiguity_status": "ambiguous",
    "bot_probability": 0.0,
    "bot_reasons": [],
    "display_name": "Andy Zhao",
    "email_count": 1,
    "emails": [
      "andy.z@posthog.com"
    ],
    "git_names": [
      "Andy Zhao",
      "andyzzhao"
    ],
    "github_database_id": null,
    "github_typename": null,
    "identity_cluster_id": "git/email/0027f67ffa878114",
    "identity_cluster_members": [
      "git/email/0027f67ffa878114"
    ],
    "identity_cluster_size": 1,
    "is_ai_assistant_identity": false,
    "is_bot": false,
    "login": null,
    "sources": [
      "git_author",
      "git_co_author"
    ]
  },
  {
    "account_type": "git_identity",
    "actor_id": "git/email/00fd1032c57f3114",
    "actor_identity_version": "1.0.0",
    "ambiguity_reasons": [
      "no_github_login: identified by git email only"
    ],
    "ambiguity_status": "ambiguous",
    "bot_probability": 0.0,
    "bot_reasons": [],
    "display_name": "Chris Volzer",
    "email_count": 1,
    "emails": [
      "chris.v@posthog.com"
    ],
    "git_names": [
      "Chris Volzer"
    ],
    "github_database_id": null,
    "github_typename": null,
    "identity_cluster_id": "git/email/00fd1032c57f3114",
    "identity_cluster_members": [
      "git/email/00fd1032c57f3114"
    ],
    "identity_cluster_size": 1,
    "is_ai_assistant_identity": false,
    "is_bot": false,
    "login": null,
    "sources": [
      "git_co_author"
    ]
  },
  {
    "account_type": "git_identity",
    "actor_id": "git/email/0249acf36d5f7f46",
    "actor_identity_version": "1.0.0",
    "ambiguity_reasons": [
      "no_github_login: identified by git email only"
    ],
    "ambiguity_status": "ambiguous",
    "bot_probability": 0.0,
    "bot_reasons": [],
    "display_name": "George Munyoro",
    "email_count": 1,
    "emails": [
      "george.t@posthog.com"
    ],
    "git_names": [
      "George Munyoro"
    ],
    "github_database_id": null,
    "github_typename": null,
    "identity_cluster_id": "git/email/0249acf36d5f7f46",
    "identity_cluster_members": [
      "git/email/0249acf36d5f7f46"
    ],
    "identity_cluster_size": 1,
    "is_ai_assistant_identity": false,
    "is_bot": false,
    "login": null,
    "sources": [
      "git_co_author"
    ]
  },
  {
    "account_type": "git_identity",
    "actor_id": "git/email/02f7536e46dfc140",
    "actor_identity_version": "1.0.0",
    "ambiguity_reasons": [
      "no_github_login: identified by git email only"
    ],
    "ambiguity_status": "ambiguous",
    "bot_probability": 0.0,
    "bot_reasons": [],
    "display_name": "Ahmed Aly",
    "email_count": 1,
    "emails": [
      "ahmedzak.23@gmail.com"
    ],
    "git_names": [
      "Ahmed Aly"
    ],
    "github_database_id": null,
    "github_typename": null,
    "identity_cluster_id": "git/email/02f7536e46dfc140",
    "identity_cluster_members": [
      "git/email/02f7536e46dfc140"
    ],
    "identity_cluster_size": 1,
    "is_ai_assistant_identity": false,
    "is_bot": false,
    "login": null,
    "sources": [
      "git_co_author"
    ]
  },
  {
    "account_type": "git_identity",
    "actor_id": "git/email/071a30c8078bb1d4",
    "actor_identity_version": "1.0.0",
    "ambiguity_reasons": [
      "no_github_login: identified by git email only"
    ],
    "ambiguity_status": "ambiguous",
    "bot_probability": 0.0,
    "bot_reasons": [],
    "display_name": "Andrew Maguire",
    "email_count": 1,
    "emails": [
      "andy.m@posthog.com"
    ],
    "git_names": [
      "Andrew Maguire",
      "Andy Maguire"
    ],
    "github_database_id": null,
    "github_typename": null,
    "identity_cluster_id": "git/email/071a30c8078bb1d4",
    "identity_cluster_members": [
      "git/email/071a30c8078bb1d4"
    ],
    "identity_cluster_size": 1,
    "is_ai_assistant_identity": false,
    "is_bot": false,
    "login": null,
    "sources": [
      "git_co_author"
    ]
  },
  {
    "account_type": "git_identity",
    "actor_id": "git/email/08f19f0df4b37451",
    "actor_identity_version": "1.0.0",
    "ambiguity_reasons": [
      "no_github_login: identified by git email only"
    ],
    "ambiguity_status": "ambiguous",
    "bot_probability": 0.0,
    "bot_reasons": [],
    "display_name": "ruby childs",
    "email_count": 1,
    "emails": [
      "ruby.childs1@gmail.com"
    ],
    "git_names": [
      "ruby childs"
    ],
    "github_database_id": null,
    "github_typename": null,
    "identity_cluster_id": "git/email/08f19f0df4b37451",
    "identity_cluster_members": [
      "git/email/08f19f0df4b37451"
    ],
    "identity_cluster_size": 1,
    "is_ai_assistant_identity": false,
    "is_bot": false,
    "login": null,
    "sources": [
      "git_author"
    ]
  },
  {
    "account_type": "git_identity",
    "actor_id": "git/email/0a161b94c3116919",
    "actor_identity_version": "1.0.0",
    "ambiguity_reasons": [
      "no_github_login: identified by git email only"
    ],
    "ambiguity_status": "ambiguous",
    "bot_probability": 0.0,
    "bot_reasons": [],
    "display_name": "Dana Zou",
    "email_count": 1,
    "emails": [
      "danazou@danas-macbook-pro.local"
    ],
    "git_names": [
      "Dana Zou"
    ],
    "github_database_id": null,
    "github_typename": null,
    "identity_cluster_id": "git/email/0a161b94c3116919",
    "identity_cluster_members": [
      "git/email/0a161b94c3116919"
    ],
    "identity_cluster_size": 1,
    "is_ai_assistant_identity": false,
    "is_bot": false,
    "login": null,
    "sources": [
      "git_co_author"
    ]
  },
  {
    "account_type": "git_identity",
    "actor_id": "git/email/0b0b69edb18ed1b4",
    "actor_identity_version": "1.0.0",
    "ambiguity_reasons": [
      "no_github_login: identified by git email only"
    ],
    "ambiguity_status": "ambiguous",
    "bot_probability": 0.0,
    "bot_reasons": [],
    "display_name": "Gustavo H. Strassburger",
    "email_count": 1,
    "emails": [
      "gustavo@posthog.com"
    ],
    "git_names": [
      "Gustavo H. Strassburger"
    ],
    "github_database_id": null,
    "github_typename": null,
    "identity_cluster_id": "git/email/0b0b69edb18ed1b4",
    "identity_cluster_members": [
      "git/email/0b0b69edb18ed1b4"
    ],
    "identity_cluster_size": 1,
    "is_ai_assistant_identity": false,
    "is_bot": false,
    "login": null,
    "sources": [
      "git_author",
      "git_co_author"
    ]
  },
  {
    "account_type": "git_identity",
    "actor_id": "git/email/0e9f834c84bab6d9",
    "actor_identity_version": "1.0.0",
    "ambiguity_reasons": [
      "no_github_login: identified by git email only"
    ],
    "ambiguity_status": "ambiguous",
    "bot_probability": 0.0,
    "bot_reasons": [],
    "display_name": "estefania",
    "email_count": 1,
    "emails": [
      "estefania.rabadan@gmail.com"
    ],
    "git_names": [
      "estefania"
    ],
    "github_database_id": null,
    "github_typename": null,
    "identity_cluster_id": "git/email/0e9f834c84bab6d9",
    "identity_cluster_members": [
      "git/email/0e9f834c84bab6d9"
    ],
    "identity_cluster_size": 1,
    "is_ai_assistant_identity": false,
    "is_bot": false,
    "login": null,
    "sources": [
      "git_co_author"
    ]
  },
  {
    "account_type": "git_identity",
    "actor_id": "git/email/10976308714ecf69",
    "actor_identity_version": "1.0.0",
    "ambiguity_reasons": [
      "no_github_login: identified by git email only"
    ],
    "ambiguity_status": "ambiguous",
    "bot_probability": 0.0,
    "bot_reasons": [],
    "display_name": "Dennis Kugelmann",
    "email_count": 1,
    "emails": [
      "dennis.kugelmann@simpleclub.com"
    ],
    "git_names": [
      "Dennis Kugelmann"
    ],
    "github_database_id": null,
    "github_typename": null,
    "identity_cluster_id": "git/email/10976308714ecf69",
    "identity_cluster_members": [
      "git/email/10976308714ecf69"
    ],
    "identity_cluster_size": 1,
    "is_ai_assistant_identity": false,
    "is_bot": false,
    "login": null,
    "sources": [
      "git_author"
    ]
  },
  {
    "account_type": "git_identity",
    "actor_id": "git/email/11be7cc8b2aa9bcf",
    "actor_identity_version": "1.0.0",
    "ambiguity_reasons": [
      "no_github_login: identified by git email only"
    ],
    "ambiguity_status": "ambiguous",
    "bot_probability": 0.0,
    "bot_reasons": [],
    "display_name": "Souheyl Gouadria",
    "email_count": 1,
    "emails": [
      "souheyl.gouadria@medius.com"
    ],
    "git_names": [
      "Souheyl Gouadria"
    ],
    "github_database_id": null,
    "github_typename": null,
    "identity_cluster_id": "git/email/11be7cc8b2aa9bcf",
    "identity_cluster_members": [
      "git/email/11be7cc8b2aa9bcf"
    ],
    "identity_cluster_size": 1,
    "is_ai_assistant_identity": false,
    "is_bot": false,
    "login": null,
    "sources": [
      "git_co_author"
    ]
  },
  {
    "account_type": "git_identity",
    "actor_id": "git/email/125a91d6b62d48b1",